{
  "effective_date": "2026-04-01",
  "valuation_as_of": "2026-09-20",
  "sources": {
    "nse_stt": "https://www.nseindia.com/static/products-services/equity-derivatives-securities-transaction-tax",
    "nse_levies": "https://www.nseindia.com/static/invest/first-time-investor-sebi-turnover-fees-stt-other-levies",
    "paytm_fno_faq": "https://www.paytmmoney.com/stocks/customer/fno-faq/onboarding-and-kyc/account-segment-activation/how-to-activate-fo-from-mobile-app-web",
    "paytm_squareoff": "https://www.paytmmoney.com/stocks/customer/fno-faq/risk-management/square-off/what-is-intraday-auto-square-off",
    "paytm_overnight": "https://www.paytmmoney.com/stocks/customer/fno-faq/trading/order-placement/what-is-overnight-order-type"
  },
  "nse_stt": {
    "option_sale_rate": 0.0015,
    "option_sale_payer": "seller",
    "option_exercise_rate": 0.0015,
    "option_exercise_base": "intrinsic_value",
    "option_exercise_payer": "purchaser",
    "futures_sale_rate": 0.0005,
    "futures_sale_payer": "seller",
    "cash_delivery_buy_rate": 0.001,
    "cash_delivery_sell_rate": 0.001,
    "cash_intraday_sale_rate": 0.00025
  },
  "paytm_money": {
    "fno_brokerage_per_unique_executed_order_inr": 10.0,
    "intraday_squareoff_charge_per_order_inr": 50.0,
    "intraday_auto_squareoff_window": "last_15_minutes",
    "mtm_squareoff_threshold_of_initial_margin": 0.75
  },
  "research_rules": {
    "fees_are_effective_date_versioned": true,
    "partial_fills_count_as_execution_events": true,
    "option_slippage_is_contract_level": true,
    "underlying_slippage_is_not_option_slippage": true
  }
}
